{
  "$schema": "../schema/writing-skills-translation.v1.schema.json",
  "canonical_language": "en",
  "count": 144,
  "format": "rhetorilex-writing-skills-translation",
  "format_version": "1.0.0",
  "groups": [
    {
      "description": "Menyusun masalah penelitian dari konteks umum hingga kontribusi yang terukur dan dapat dipertanggungjawabkan.",
      "id": "research-framing",
      "name": "Kerangka Penelitian"
    },
    {
      "description": "Merepresentasikan, membandingkan, dan menyintesis literatur dengan menjaga setiap klaim tetap terhubung pada sumbernya.",
      "id": "literature-writing",
      "name": "Penulisan Literatur"
    },
    {
      "description": "Membangun argumentasi akademik yang dapat ditelusuri melalui klaim, pembedaan, konsesi, dan implikasi yang terukur.",
      "id": "argumentation",
      "name": "Argumentasi Akademik"
    },
    {
      "description": "Mengoordinasikan bab penelitian panjang agar setiap bagian menjalankan peran yang jelas dalam keseluruhan argumen.",
      "id": "thesis-and-dissertation",
      "name": "Penulisan Tesis dan Disertasi"
    },
    {
      "description": "Menyesuaikan isi penelitian untuk genre publikasi, komunikasi editorial, dan pernyataan transparansi.",
      "id": "publication-writing",
      "name": "Penulisan Publikasi"
    },
    {
      "description": "Menghubungkan pertanyaan ilmiah dengan bukti terdahulu, ekspektasi yang dapat diuji, dan kontribusi yang terukur.",
      "id": "scientific-study-framing",
      "name": "Kerangka Studi Ilmiah"
    },
    {
      "description": "Melaporkan rancangan, pelaksanaan, analisis, dan tata kelola studi dengan rincian yang memadai untuk penilaian.",
      "id": "methods-writing",
      "name": "Penulisan Metode"
    },
    {
      "description": "Melaporkan observasi dan estimasi secara presisi sebelum beralih ke interpretasi.",
      "id": "results-writing",
      "name": "Penulisan Hasil"
    },
    {
      "description": "Menafsirkan temuan dengan mempertimbangkan rancangan, ketidakpastian, literatur terdahulu, dan penjelasan alternatif.",
      "id": "discussion-writing",
      "name": "Penulisan Pembahasan"
    },
    {
      "description": "Menyesuaikan bahasa ilmiah dengan rancangan, kekuatan bukti, ketidakpastian, dan cakupan.",
      "id": "scientific-claim-control",
      "name": "Pengendalian Klaim Ilmiah"
    },
    {
      "description": "Menulis ulang materi akademik dengan mempertahankan makna, atribusi, angka, dan kekuatan inferensi.",
      "id": "paraphrasing",
      "name": "Parafrasa"
    }
  ],
  "language": "id",
  "release": "0.2.0",
  "skills": [
    {
      "description": "Panduan membangun konteks penelitian agar konteks, batas, dan kontribusi penelitian dinyatakan secara jelas serta sesuai bukti.",
      "id": "writing.academic.research_framing.establishing_a_research_context",
      "name": "Membangun konteks penelitian"
    },
    {
      "description": "Panduan memperkenalkan topik agar konteks, batas, dan kontribusi penelitian dinyatakan secara jelas serta sesuai bukti.",
      "id": "writing.academic.research_framing.introducing_a_topic",
      "name": "Memperkenalkan topik"
    },
    {
      "description": "Panduan menegaskan signifikansi agar konteks, batas, dan kontribusi penelitian dinyatakan secara jelas serta sesuai bukti.",
      "id": "writing.academic.research_framing.establishing_significance",
      "name": "Menegaskan signifikansi"
    },
    {
      "description": "Panduan mendefinisikan masalah penelitian agar konteks, batas, dan kontribusi penelitian dinyatakan secara jelas serta sesuai bukti.",
      "id": "writing.academic.research_framing.defining_a_research_problem",
      "name": "Mendefinisikan masalah penelitian"
    },
    {
      "description": "Panduan mengidentifikasi kesenjangan penelitian agar konteks, batas, dan kontribusi penelitian dinyatakan secara jelas serta sesuai bukti.",
      "id": "writing.academic.research_framing.identifying_a_research_gap",
      "name": "Mengidentifikasi kesenjangan penelitian"
    },
    {
      "description": "Panduan menyatakan tujuan penelitian agar konteks, batas, dan kontribusi penelitian dinyatakan secara jelas serta sesuai bukti.",
      "id": "writing.academic.research_framing.stating_research_aims",
      "name": "Menyatakan tujuan penelitian"
    },
    {
      "description": "Panduan menulis pertanyaan penelitian agar konteks, batas, dan kontribusi penelitian dinyatakan secara jelas serta sesuai bukti.",
      "id": "writing.academic.research_framing.writing_research_questions",
      "name": "Menulis pertanyaan penelitian"
    },
    {
      "description": "Panduan menyatakan hipotesis agar konteks, batas, dan kontribusi penelitian dinyatakan secara jelas serta sesuai bukti.",
      "id": "writing.academic.research_framing.stating_hypotheses",
      "name": "Menyatakan hipotesis"
    },
    {
      "description": "Panduan menjelaskan cakupan agar konteks, batas, dan kontribusi penelitian dinyatakan secara jelas serta sesuai bukti.",
      "id": "writing.academic.research_framing.describing_scope",
      "name": "Menjelaskan cakupan"
    },
    {
      "description": "Panduan menyatakan kontribusi agar konteks, batas, dan kontribusi penelitian dinyatakan secara jelas serta sesuai bukti.",
      "id": "writing.academic.research_framing.stating_contributions",
      "name": "Menyatakan kontribusi"
    },
    {
      "description": "Panduan menjelaskan kebaruan secara hati-hati agar konteks, batas, dan kontribusi penelitian dinyatakan secara jelas serta sesuai bukti.",
      "id": "writing.academic.research_framing.describing_novelty_cautiously",
      "name": "Menjelaskan kebaruan secara hati-hati"
    },
    {
      "description": "Panduan memperkenalkan studi terdahulu dengan atribusi yang tepat, hubungan antarsumber yang jelas, dan sintesis yang dapat ditelusuri.",
      "id": "writing.academic.literature_writing.introducing_previous_studies",
      "name": "Memperkenalkan studi terdahulu"
    },
    {
      "description": "Panduan menyintesis literatur dengan atribusi yang tepat, hubungan antarsumber yang jelas, dan sintesis yang dapat ditelusuri.",
      "id": "writing.academic.literature_writing.synthesising_literature",
      "name": "Menyintesis literatur"
    },
    {
      "description": "Panduan membandingkan studi dengan atribusi yang tepat, hubungan antarsumber yang jelas, dan sintesis yang dapat ditelusuri.",
      "id": "writing.academic.literature_writing.comparing_studies",
      "name": "Membandingkan studi"
    },
    {
      "description": "Panduan mengontraskan studi dengan atribusi yang tepat, hubungan antarsumber yang jelas, dan sintesis yang dapat ditelusuri.",
      "id": "writing.academic.literature_writing.contrasting_studies",
      "name": "Mengontraskan studi"
    },
    {
      "description": "Panduan menjelaskan konsensus ilmiah dengan atribusi yang tepat, hubungan antarsumber yang jelas, dan sintesis yang dapat ditelusuri.",
      "id": "writing.academic.literature_writing.describing_scholarly_consensus",
      "name": "Menjelaskan konsensus ilmiah"
    },
    {
      "description": "Panduan menjelaskan perbedaan pendapat ilmiah dengan atribusi yang tepat, hubungan antarsumber yang jelas, dan sintesis yang dapat ditelusuri.",
      "id": "writing.academic.literature_writing.describing_scholarly_disagreement",
      "name": "Menjelaskan perbedaan pendapat ilmiah"
    },
    {
      "description": "Panduan mengidentifikasi keterbatasan penelitian terdahulu dengan atribusi yang tepat, hubungan antarsumber yang jelas, dan sintesis yang dapat ditelusuri.",
      "id": "writing.academic.literature_writing.identifying_limitations_in_prior_work",
      "name": "Mengidentifikasi keterbatasan penelitian terdahulu"
    },
    {
      "description": "Panduan mengkritik penelitian terdahulu dengan atribusi yang tepat, hubungan antarsumber yang jelas, dan sintesis yang dapat ditelusuri.",
      "id": "writing.academic.literature_writing.critiquing_previous_research",
      "name": "Mengkritik penelitian terdahulu"
    },
    {
      "description": "Panduan membatasi kritik dengan atribusi yang tepat, hubungan antarsumber yang jelas, dan sintesis yang dapat ditelusuri.",
      "id": "writing.academic.literature_writing.qualifying_criticism",
      "name": "Membatasi kritik"
    },
    {
      "description": "Panduan menetapkan kesenjangan literatur dengan atribusi yang tepat, hubungan antarsumber yang jelas, dan sintesis yang dapat ditelusuri.",
      "id": "writing.academic.literature_writing.establishing_a_literature_gap",
      "name": "Menetapkan kesenjangan literatur"
    },
    {
      "description": "Panduan menulis bagian karya terkait dengan atribusi yang tepat, hubungan antarsumber yang jelas, dan sintesis yang dapat ditelusuri.",
      "id": "writing.academic.literature_writing.writing_related_work",
      "name": "Menulis bagian karya terkait"
    },
    {
      "description": "Panduan beralih antarsumber dengan atribusi yang tepat, hubungan antarsumber yang jelas, dan sintesis yang dapat ditelusuri.",
      "id": "writing.academic.literature_writing.transitioning_between_sources",
      "name": "Beralih antarsumber"
    },
    {
      "description": "Panduan menulis dengan sitasi terpadu dengan atribusi yang tepat, hubungan antarsumber yang jelas, dan sintesis yang dapat ditelusuri.",
      "id": "writing.academic.literature_writing.citation_integrated_writing",
      "name": "Menulis dengan sitasi terpadu"
    },
    {
      "description": "Panduan menyusun klaim akademik untuk membangun argumen akademik yang terukur, runtut, dan selaras dengan kekuatan bukti.",
      "id": "writing.academic.argumentation.making_an_academic_claim",
      "name": "Menyusun klaim akademik"
    },
    {
      "description": "Panduan mendukung klaim untuk membangun argumen akademik yang terukur, runtut, dan selaras dengan kekuatan bukti.",